{
  "$schema": "https://json-schema.org/draft/2020-12/schema",
  "type": "object",
  "properties": {
    "slug": {
      "type": "string"
    },
    "title": {
      "type": "string"
    },
    "description": {
      "type": "string"
    },
    "ogTitle": {
      "type": "string"
    },
    "ogDescription": {
      "type": "string"
    },
    "ogImage": {
      "anyOf": [
        {
          "type": "string"
        },
        {
          "type": "null"
        }
      ]
    },
    "canonical": {
      "type": "string"
    },
    "bodyHtml": {
      "type": "string"
    },
    "$schema": {
      "type": "string"
    }
  },
  "required": [
    "slug",
    "title",
    "description",
    "ogTitle",
    "ogDescription",
    "ogImage",
    "canonical",
    "bodyHtml"
  ]
}