{
	"slug": "creams",
	"title": "تشویقی‌های کرمی و سالم برای گربه‌ها",
	"description": "می‌خواهید دوست چهارپایتان را با خوراکی کرمی، سالم و کم‌کالری نوازش کنید؟ این تشویقی خوشمزه برای ببر کوچک شما عالی است!",
	"ogTitle": "تشویقی‌های کرمی و سالم برای گربه‌ها",
	"ogDescription": "می‌خواهید دوست چهارپایتان را با خوراکی کرمی، سالم و کم‌کالری نوازش کنید؟ این تشویقی خوشمزه برای ببر کوچک شما عالی است!",
	"ogImage": null,
	"canonical": "https://voskes.ir/blog/creams",
	"bodyHtml": "<div class=\"d--flex\" style=\"flex-wrap: wrap;\">\n                    \n\n                                        \n                            <div id=\"id-34-77\" class=\"section section__textblock section--none section--padding bg-c--hard-conversion txt-c--nero title-c--nero link-c--nero\">\n      <div class=\"san-container\" data-span=\"full-desktop\">\n                    <div class=\"san-col\" data-span=\"12 desktop-xl-6\">\n        <div class=\"j-content txt--left pb--0 desktop-xl-pb--60\" data-block=\"\" data-type=\"container\">\n      <div class=\"j-content\" data-type=\"text\">\n          <h1>خوراکی خامه ای و سالم!</h1>\n\n                </div>\n    </div>\n    </div>\n\n  <div class=\"san-col\" data-span=\"12 desktop-xl-6\">\n          <div class=\"j-content txt--left pt--0 desktop-xl-pt--60\" data-block=\"\" data-type=\"container\">\n      <div class=\"j-content\" data-type=\"text\">\n          <p>می‌خواهید دوست چهارپایتان را با خوراکی کرمی، سالم و کم‌کالری نوازش کنید؟ این تشویقی خوشمزه برای ببر کوچک شما عالی است!</p>\n\n                </div>\n    </div>\n        </div>\n          </div>\n</div>\n            \n            \n            \n            \n            \n            \n            \n            \n                    \n\n                                        \n            \n            \n                              \n\n<div id=\"id-38-25\" class=\"highlight section section--none txt-c--nero bg-c--white title-c--nero link-c--nero link-hc--nero\">\n    <div class=\"san-container p--0\" data-span=\"full\" data-options=\"\" data-no-gap=\"\"><div class=\"san-col highlight__media highlight__media--half\" data-span=\"12 tablet-lg-6\"><div class=\"ar-tablet-lg--4by3 ar--4by3 ar\" style=\"height: 100%;\"><div class=\"highlight__single-image ar__content\">\n      <img src=\"/uploads/original/creams_–_11-p.webp\" alt=\"کرم های مخصوص گربه ها\" loading=\"lazy\" decoding=\"async\" class=\"obj--cover\">\n</div>\n</div></div><div class=\"san-col pv--15 tablet-lg-pv--0\" data-span=\"12 tablet-lg-6\"><div class=\"san-container ps--0 mobile-lg-ps--15 tablet-lg-ps--0 h-100\" data-span=\"full-tablet-lg\"><div class=\"san-col tablet-lg-ps--0\"><div class=\"j-content\" data-type=\"container\" data-centered=\"\" data-block=\"\"><div class=\"j-content txt--left\" data-type=\"text\"><h3>موجود در 3 طعم لذیذ!</h3><p>در واقع، کرم‌های ما نه‌تنها عطر و طعم می‌کنند، مصرف مایعات را افزایش می‌دهند. Prr-fection وجود دارد! بسته بندی خوش دست با درپوش چرخاننده قابل بسته شدن، همچنین به این اسنک اجازه می دهد تا دو روز پس از باز شدن در یخچال نگهداری شود.</p><img src=\"/assets/images/tip_cat.png\" class=\"float-left mr--15\" style=\"height:55px;\" alt=\"\"><p><em>آیا گربه شما اهل غذا خوردن است؟ خامه ها را به عنوان رویه روی تکه های خشک قرار دهید تا طعم بیشتری پیدا کنند. موفقیت تضمین شده است!</em></p></div></div>\n</div></div></div></div>\n</div>\n            \n            \n            \n            \n            \n            \n                    \n\n                                        \n                            <div id=\"id-34-89\" class=\"section section__textblock section--none section--padding bg-c--hard-conversion txt-c--nero title-c--nero link-c--nero\">\n      <div class=\"san-container\">\n                    <div class=\"san-col\">\n        <div class=\"j-content txt--center pb--0 desktop-xl-pb--60\" data-type=\"container\">\n      <div class=\"j-content\" data-type=\"text\">\n          <h2>هر طعمی برای حمایت از نیازهای مختلف گربه شما با مواد اضافی غنی شده است.</h2>\n\n                </div>\n    </div>\n                </div>\n\n          </div>\n</div>\n            \n            \n            \n            \n            \n            \n            \n            \n                    \n\n                                        \n                            <div id=\"id-34-88\" class=\"section section__textblock section--none section--padding bg-c--white txt-c--nero title-c--nero link-c--nero\">\n      <div class=\"san-container\" data-span=\"full-desktop\">\n                    <div class=\"san-col\" data-span=\"12 desktop-xl-6\">\n        <div class=\"j-content txt--left pb--0 desktop-xl-pb--60\" data-block=\"\" data-type=\"container\">\n      <div class=\"j-content\" data-type=\"text\">\n          <h4>کرم با ماهی تن و ماهی خال مخالی</h4><p>یک خوراکی خوشمزه برای دوست چهارپای شما که عاشق ماهی است.</p><h4>خامه با مرغ</h4><p>یک میان وعده خوشمزه بدون غلات برای گربه شما که عاشق مرغ است.</p>\n\n                </div>\n    </div>\n    </div>\n\n  <div class=\"san-col\" data-span=\"12 desktop-xl-6\">\n          <div class=\"j-content txt--left pt--0 desktop-xl-pt--60\" data-block=\"\" data-type=\"container\">\n      <div class=\"j-content\" data-type=\"text\">\n          <h4>خامه با ماهی تن و گوشت گاو</h4><p>برای کسانی که نمی توانند انتخاب کنند، ما یک نوع ماهی و گوشت داریم.</p><img src=\"/assets/images/tip_cat.png\" class=\"float-left mr--15\" style=\"height:55px;\" alt=\"\"><p>برای تعامل سرگرم کننده با گربه خود، کرم را مستقیماً از درپوش بدهید!</p>\n\n                </div>\n    </div>\n        </div>\n          </div>\n</div>\n            \n            \n            \n            \n            \n            \n            \n            \n                    \n\n                                        \n            \n            \n                              \n\n<div id=\"id-38-26\" class=\"highlight section section--none txt-c--nero bg-c--transparent title-c--cat-primary link-c--nero link-hc--nero\">\n    <div class=\"san-container p--0\" data-span=\"full\" data-options=\"\" data-no-gap=\"\"><div class=\"san-col highlight__media highlight__media--half\" data-span=\"12 tablet-lg-6\"><div class=\"ar-tablet-lg--4by3 ar--4by3 ar\" style=\"height: 100%;\"><div class=\"highlight__single-image ar__content\">\n      <img src=\"/uploads/landscape/landscape-rode_kat1-images-38-26.png\" alt=\"چرا دوست پشمالو شما کرم های ما را دوست دارد\" loading=\"lazy\" decoding=\"async\" class=\"obj--cover\">\n</div>\n</div></div><div class=\"san-col pv--15 tablet-lg-pv--0\" data-span=\"12 tablet-lg-6\"><div class=\"san-container ps--0 mobile-lg-ps--15 tablet-lg-ps--0 h-100\" data-span=\"full-tablet-lg\"><div class=\"san-col tablet-lg-ps--0\"><div class=\"j-content\" data-type=\"container\" data-centered=\"\" data-block=\"\"><div class=\"j-content txt--left\" data-type=\"text\"><h2>چرا دوست پشمالو شما کرم های ما را دوست دارد:</h2><ul><li><strong>کاملاً بدون دانه و گلوتن</strong></li><li><strong>مواد طبیعی</strong></li><li><strong>مصرف مایعات را ترویج می کند</strong></li><li><strong>کم کالری</strong></li><li><strong>انتخاب از 3 طعم خوشمزه 90 گرمی</strong></li><li><strong>بسته بندی با درپوش چرخاننده قابل آب بندی</strong></li><li><strong>حداقل 24 ماه و 2 روز پس از باز شدن در یخچال قابل نگهداری است</strong></li><li><strong>غنی شده با مواد اضافی برای حفظ سلامت گربه شما</strong></li></ul><img src=\"/assets/images/tip_cat.png\" class=\"float-left mr--15\" style=\"height:55px;\" alt=\"\"><p><em>بهتر است کرم ها را قبل از استفاده ورز دهید!</em></p><a href=\"/cat-treats/creams.html\" class=\"btn mt--15 btn--nero btn--normal\">تمام طعم ها را کشف کنید</a></div></div>\n</div></div></div></div>\n</div>\n            \n            \n            \n            \n            \n            \n            </div>"
}
